{
  "fact_id": "fact-classification-001",
  "producer": "autocad.semantic-adapter",
  "host_ref": {"host_type": "AUTOCAD", "host_instance_id": "acad-1", "document_id": "doc-1"},
  "source_revision": 7,
  "subject_native_ref": {"document_id": "doc-1", "native_id": "A31", "native_kind": "LWPOLYLINE"},
  "fact_kind": "CLASSIFICATION",
  "predicate": "layer",
  "value": "A-WALL",
  "value_type": "STRING",
  "unit": null,
  "geometry_ref": null,
  "source_scheme": "autocad.layer",
  "source_code": "A-WALL",
  "provenance": ["host-read:A31@7"]
}
