{
  "fact_id": "fact-bounds-001",
  "producer": "autocad.semantic-adapter",
  "host_ref": {"host_type": "AUTOCAD", "host_instance_id": "acad-1", "document_id": "doc-1"},
  "source_revision": 7,
  "subject_native_ref": {"document_id": "doc-1", "native_id": "A31", "native_kind": "LWPOLYLINE"},
  "fact_kind": "BOUNDS",
  "predicate": null,
  "value": {"min": [0.0, 0.0, 0.0], "max": [10.0, 3.0, 0.0]},
  "value_type": "OBJECT",
  "unit": "m",
  "geometry_ref": "native://doc-1/A31/geometry",
  "source_scheme": null,
  "source_code": null,
  "provenance": []
}
